{
  "schema_version": 1,
  "id": "m6-reference-library",
  "actions": [
    {
      "id": "hold_position",
      "channel": "locomotion",
      "parameters": [],
      "node": { "type": "hold_position" }
    },
    {
      "id": "leave",
      "channel": "navigation",
      "parameters": [
        { "id": "destination", "type": "stable_id" }
      ],
      "node": { "type": "navigate", "destination_id": "$destination" }
    }
  ],
  "subgraphs": [
    {
      "id": "guarded_exit",
      "entry_id": "root",
      "parameters": [
        { "id": "destination", "type": "stable_id" }
      ],
      "nodes": [
        {
          "id": "root",
          "type": "selector",
          "children": ["leave", "hold"]
        },
        {
          "id": "leave",
          "type": "navigate",
          "action_id": "leave",
          "parameters": { "destination": "$destination" }
        },
        {
          "id": "hold",
          "type": "hold_position",
          "action_id": "hold_position"
        }
      ]
    }
  ],
  "presets": [
    {
      "id": "guarded_exit",
      "subgraph_id": "guarded_exit",
      "parameters": { "destination": "exit_n" }
    }
  ]
}
